{
  "schema_version": "vacua.mcp.duplicate-list.v1",
  "items": [
    {
      "group_id": "dup-3a4b5c6d7e8f9012",
      "member_count": 3,
      "file_size": 104857600,
      "logical_duplicate_bytes": 209715200,
      "kernel_private_bytes": 0,
      "confirmed_reclaim_lower_bound": 0,
      "estimated_reclaim": 209715200,
      "content_identity_verified": true,
      "algorithm": "BLAKE3",
      "kernel_private_bytes_known_members": 3,
      "kernel_private_bytes_unknown_members": 0
    }
  ],
  "total_count": 1,
  "limit": 50,
  "next_cursor": null
}
